EngText Index,EstText Index,Cosine Similarity Score,Similarity Bin,EstText,EngText,Similarity
11455,2965,0.05089496821,1,"Lugupeetud istungi juhataja, austatud Peaminister!

Kõigepealt jõudu teile selles keerulises olukorras tegutsemisel!

Edastasime eile meie headele koalitsioonipartneritele EKRE Riigikogu fraktsiooni poolt ühe pöördumise.

Loen selle siinkohal ette, ütlen kohe, et me ei vastandu sellega koalitsioonipartneritele, vastupidi tänases olukorras on meil vaja ühtse löögirusikana tegutsevat koalitsiooni, meil on vaja tegusid.

Järgnevalt pöördumine:

Inimese üks põhiõigusi on õigus elule.

Eesti riigi tänaste juhtidena vastutame oma rahva ees. Koroonaviiruse ülemaailmse leviku olukorras peab meie peamiseks eesmärgiks olema Eesti inimeste elu ja tervist ohtu seadvate tingimuste minimeerimine. Koroonaviiruse omadused on lõpuni teadmata. On piisavalt hoiatavaid näiteid hilinenud reageerimisest.

Põhja-Itaalias on tekkinud kriisiolukord. Sealsete tunnustatud meedikute väljaütlemiste järgi jäädi rangemate piirangute ja ennetavate meetmete rakendamisega 2-3 nädalat hiljaks.

Eesti Konservatiivse Rahvaerakonna fraktsioon leiab, et koroonaviiruse tõrjumiseks ja suurema kahju ennetamiseks on Eestis vaja rakendada senisest jõulisemaid meetmeid.

Peame olema sündmustest ees, mitte reageerima tagantjärele.

Anname endale aru, et rangemad piirangud ja meetmed tekitavad inimestele ja ettevõtjatele ebamugavusi, kuid eesmärgiks peab olema õigeaegse reageerimisega ära hoida oluliselt suurema kahju tekkimine tulevikus.

EKRE fraktsioon leiab, et on vaja rakendada alljärgnevaid meetmeid:

● Kontroll piiridel. Meie rahva turvalisuse huvides rakendada koheselt kontroll kõigi riiki sisenevate isikute üle, neile kes saabuvad palaviku või muude spetsiifiliste sümptomitega panna kohustus testida ennast koroonaviiruse suhtes.

● Mitte lubada riiki viirusriskiga piirkondadest saabuvaid turiste ja kohustada kõiki välisriikidest Eestisse saabujaid kohandama endale 14 päevast kodust karantiini.

● Peatada esmaspäevast 16. märtsist koolide ja ülikoolide töö, võimalusel viia koolid üle e-õppele.

● Seada rahvakogunemiste ja ürituste korraldamisele kohustuslikud piirangud kuni aprilli lõpuni.

● Kodusesse karantiini jäävaid isikud peavad saama selge sõnumi, et kui nad kodusest karantiinist kinni ei pea, rakendatakse neile karantiini sundtäitmist või muid seadusest tulenevaid sanktsioone.

Meie fraktsioon toetab ülaltoodud meetmete rakendamiseks eriolukorra kehtestamist.

Kindlasti ei soovi me kedagi hirmutada, ettevaatlikkus ja ennetav tegutsemine on rahvale mõistetav, isegi kui selle eelised selguvad alles tagantjärele.

Kinnitan veelkord, et toetame peaministrit ja valitsust ning ootame konkreetseid otsuseid!

Aitäh!

Pöördumise allkirjastasid kõik Riigikogu EKRE fraktsiooni liikmed: Merry Aart, Riho Breivel, Helle-Moonika Helme, Peeter Ernits, Urmas Espenberg, Kalle Grünthal, Ruuben Kaalep, Tiit Kala, Uno Kaskpeit, Kert Kingo, Leo Kunnas, Alar Laneman, Siim Pohlak, Anti Poolamets, Paul Puustusmaa, Henn Põlluaas, Urmas Reitelmann, Kai Rimmel, Jaak Valge.","Just suppose the play was cancelled because the school was using black actors. Would this be the only place you would see this story?A small, state college in northern Pennsylvania has canceled a musical about a week before it was scheduled to open after the playwright objected to the use of white actors for South Asian characters.Clarion University had spent much of the year preparing to stage the punk rock version of  Jesus in India,  by dramatist Lloyd Suh, which ran off-Broadway in 2013 and received favorable reviews.Suh, who owns the rights to the musical, sent an e-mail on Monday to the school s play director Marilouise Michel ordering her to either replace the non-Asian actors with  ethnically appropriate actors  or cancel the production, which was due to open Nov. 18. I have severe objections to your use of Caucasian actors in roles clearly written for South Asian actors, and consider this an absolutely unacceptable distortion of the play,  Suh wrote in the e-mail provided to Reuters by Michel.Michel told Reuters on Thursday that one of the Indian roles was to be played by a biracial girl, and the rest by whites. They were not doing the roles in  brownface  or using dialects, she said, but Suh rejected any solution other than removing them.Suh, who has another play,  Exotic Oriental Murder Mystery,  running off-Broadway this month, did not respond to requests for comment, nor did his agent, Beth Blickers.Michel said Clarion University, with about 4,900 students, has a student body that is 0.6 percent Asian and that no Asians auditioned for the play.She tried several times to reach Suh by phone to discuss aspects of his play, but he did not take her calls before it was canceled on Tuesday, she said.When he saw the cast photos earlier this month, he demanded through Blickers to know the ethnicity of the actors, she said. I couldn t stop myself from crying when I saw the photos and realized what was happening,  Suh wrote in his e-mail.On Tuesday, the day after Suh s e-mail, the New York Times published an opinion piece by Indian-American comedian Aziz Ansari decrying the treatment of Asian, particularly Indian actors, in the media but also noted that such actors were harder to find.VIA: Reuters",Dissimilar
3708,2486,0.00890877936,1,"Laupäeval kogunes Horvaatia pealinnas Zagrebis erinevatel hinnangutel 15 000-20 000 inimest, et protestida koroonapasside ja muude piirangute vastu. Meeleavaldused on väiksemas mahus jätkunud ka järgmistel päevadel, vahendab Balkan Insight.

Linna peaväljakul toimunud üritusel kanti suuri plakateid nii Neitsi Maarja kujutise kui sõnumitega, nagu ""Ei pimedale usule võimudesse"" ning ""Ela ja lase teistel elada"". Pärast miitingut proovisid mõned osalejad siseneda kohaliku rahvusringhäälingu majja, kuid politsei tõkestas nende tee. Kohaliku politseiametniku sõnul püüab politsei kindlaks teha protestimarsi organiseerijaid, kuna üritus polnud ametlikult registreeritud.

Foto: Vigilare

Üritusel esines ka üksikuid intsidente meediaga – näiteks võeti Al Jazeera ajakirjanikult mikrofon käest ja osad reporterid said sõimata.

Foto: Vigilare

Esmaspäeval kogunes umbes 30 tudengit kohaliku ülikooli ette, et protestida koroonapassi nõudmise vastu ruumidesse sisenemisel. Horvaatias nõutakse alates 16. novembrist koroonapassi avalikesse kohtadesse ja riigile kuuluvatesse hoonetesse sisenemisel. Üks protestijatest ütles meediale, et ei usalda koroonavaktsiine, kuna need on tema hinnangul kiirkorras kasutusloa saanud, ning lubas seista vastu igat sorti segregatsioonile ja diskrimineerimisele.

Seni on riigis vallandatud kuus tervishoiutöötajat ja neli sotsiaaltöötajat, kes pole olnud nõus töökohas koroonatesti tegema. Horvaatias on erinevalt Eestis koroonapassiga võrdsustatud ka negatiivne test.

Riigi koroonaolukord on halvenemas – teisipäeval registreeriti nelja miljoni elanikuga riigis 4926 uut nakkusjuhtu ja 73 surma. Tervishoiuminister Vili Beroš nimetas meeleavaldajaid teisipäeval silmakirjalikeks, kuna hoolimata testimise, vaktsineerimise ja piirangute vastasusest tulevad nad haigestudes ""ülekoormatud meditsiinisüsteemi uksele koputama"". Beroši sõnul on piirangute ja vaktsineerimise alternatiiviks testimine. Ta süüdistas ""populiste"" inimeste manipuleerimises poliitilise kasu nimel.

Beroš tunnistas, et koroonapassid ei peata viiruse levikut, kuid aitavad levikukiirust alla tuua.

Toimetas Jaanus Vogelberg","There are many reasons that people come down with a cough. This symptom can be caused by respiratory infections like bronchitis or pneumonia, a particularly bad allergic reaction.
Pineapples contain bromelain, an enzyme with anti-inflammatory properties. It fights infections and kills bacteria. The juice from fresh pineapples can suppress coughs five times more effectively than cough syrup.
Nutritional Value of Pineapples
Pineapples contain potassium, copper, manganese, calcium, magnesium, vitamin C, beta carotene, thiamin, B6, and folate, as well as soluble and insoluble fiber, and bromelain.
According to studies, pineapple juice is effective medicine for curing those suffering from tuberculosis and other coughing issues like sinusitis and bronchitis. Drinking pineapple juice helps soothe a sore throat and aids the body to expel mucous easily.
Pineapple contains high amounts of vitamin C (another power antioxidant) as well as a wealth of vitamin A and minerals like magnesium, manganese and potassium, all of which help boost the immune system and make it easier for the body to fight off infections that cause coughs in the first place.
Pineapple Cough Suppressant Recipe
Ingredient:
Fresh lemon juice – approximately a ¼ of a cup
1 cup of fresh pineapple juice – preferably home juiced
1 tablespoon of unprocessed honey
A small piece of ginger – about 3 inches long
Half a teaspoon of hot chili pepper
Direction:
Blend or juice all ingredients. Take ¼ cup of this remedy up to 3 times a day and your cough or sore throat will be gone in no time.
Other benefits of pineapple juice
Cancer Prevention
Pineapples are also rich in various other antioxidants, including vitamin A, beta carotene, bromelain, various flavonoid compounds, and high levels of manganese, they help fight against free radicals. Free radicals are groups of atoms that do major damage when they come in contact with your cell membranes or DNA.
Cure Arthritis
Pineapple has anti-inflammatory qualities, so including the fruit in your diet can alleviate the pain of arthritis, along with similar conditions, like gout and carpal tunnel syndrome. It also can help improve the condition overall by strengthening your bones.
Kidney Health
Pineapple juice is rich in potassium which promotes kidney function. The potassium helps you with electrolyte balance, which help with muscle cramps and soreness.
Sources include:
snopes.com, fitlife.tv, sunflowernaturals.com
Read:
This Homemade Elixir Cure Nagging Cough & Lung Inflammation Very Effectively
",Dissimilar
17573,11111,0.08642955869,1,"224 lehekülje paksune raamat sisaldab pea kahe luulekogu jagu luuletusi ja autobiograafilise jutustuse. Autori vanemad said kokku Vabadussõjas. Tema ema tuli Soome Lottana vabatahtlikult sõtta meditsiiniõeks ja leidis armastuse. Armastusest Eesti vastu ja inimeste vahel sündis Elvine.

Saatus viis autori Kanadas omakorda kokku ingerlasest Eesti vabaduse eest sõdinud Paul Oskoga. Armastusest vaba Eesti vastu on sündinud ka see luule.

Huvilised saavad teost soetada Apollo,Rahva Raamatu ja trükikoja TRÜKIVIIS poodidest ja e-poodidest.","Some areas in the US are seeing a decline in coronavirus cases, but the country is still in the midst of the Omicron wave. The 7-day average of new daily cases is over 700,000, but some states are not seeing an increase in cases. Although Omicron cases peaked in the Northeast, hospitalizations are still high and patient care is difficult due to a shortage of staff. Overall, the US appears to be just past the peak in cases, but there will still be a significant number of cases and deaths on the way down. Intensive care units across the country are 83% full, and one-third of ICU beds are being used for COVID-19 patients. Some hospitals are struggling to accommodate critical care patients, and hospital admissions are likely to peak a week or two after the peak in cases. Although Omicron wave deaths appear to be less severe than earlier waves, the severity of the current wave is still unknown, and mortality rates may peak in 2-3 weeks.",Dissimilar
44,8710,0.02903621644,1,"""Just siin peitubki Õhtumaa kummaline ja patoloogiline enesevihkamine: ühest küljest püütakse avada uks võõrastele väärtustele, ent omaenda ajaloos nähakse vaid julmusi ja koledusi, suurt ja üllast aga enam mitte. Kui Euroopa tahab ellu jääda, vajab ta uut mõistmist iseendast.""

Need sõnad kirjutas kardinal Joseph Ratzinger 13. aprillil 2005 ajalehes Süddeutsche Zeitung, vaid mõned päevad enne paavstiks valimist.

Probleemid, millele kardinal Ratzinger viitas, on vahepealsetel aastatel ainult süvenenud. Euroopa Liidu nime all püütakse üles ehitada rahvusriike allaneelavat multikultuurilist impeeriumit, mis on avanud oma piirid massilisele immigratsioonile nn Kolmandast maailmast ning mis püüab ""sallivuse"" ja ""vabaduse"" edendamise sildi lämmatada traditsioonilisi kristlikke ja rahvuslikke väärtusi.

Sellest ajendatult nendibki aastal 2017 Prantsusmaa pealinnas kokku tulnud rühm konservatiivseid õpetlasi sel nädalal Objektiivis esmakordselt eestikeelsena avaldatud Pariisi manifestis: ""Oleme jõudnud tupikusse. Euroopa tuleviku suurim oht ei ole Vene avantürism ega ka moslemite immigratsioon. Tõelist Euroopat ohustab hoopis Euroopas vohav väär, lämmatav mõtteviis.""

Need read võivad esialgu üllatavana tunduda. Putini Venemaast on tehtud tänapäeva ""liberaalse"" lääne peavaenlane, kes sekkub kõikjal, mõjutab valimistulemusi, õõnestab demokraatiat, õhutab ""populismi"" ja ""äärmuslust"" jne. Iga lääne ühiskonna kriitik tembeldatakse otsekohe Putini käsilaseks.

Kuid islami taustaga immigrantide sissevool erinevatesse Euroopa riikidesse on ju tõepoolest endaga kaasa toonud palju äärmiselt tõsiseid probleeme, alates integratsiooniraskustest ja lõpetades terrorismiga. Kui vaadata Pew' uurimiskeskuse prognoose, siis kõige karmima variandi järgi on aastal 2050 Euroopa suurriikide Suurbritannia, Prantsusmaa ja Saksamaa elanike seas moslemite suhtarv ligi 20 protsenti, Rootsis koguni üle 30. Islami taustaga inimeste osakaal Euroopa ühiskondades kasvab isegi immigratsiooni vähenedes, sel lihtsal põhjusel, et moslemitel on palju rohkem lapsi kui põliseurooplastel.

Miks ei pea Pariisi manifesti koostajad seda kõige suuremaks ohuks?

Moslemite juurdekasvuga võib küll nii olla, kuid sellele vaatamata on Euroopa saatus endiselt põliseurooplaste käes. Sisuliselt ütleb sedasama ka Tartu ülikooli usuteaduskonna võrdleva usundiloo vanemteadur Peeter Espak – nimelt et Euroopat ei ohusta islami invasioon, vaid pigem Euroopa enda rumalus ja kultuuriline mandumine: ""Omaviha ja enda juurte ja kultuuride häbenemine või vihkamine on need faktorid, mis Euroopat hääbumiseni võivad viia.""

Niisiis tuleb meil mõista, kus on probleemi juured. Kardinal Ratzingeril ja hilisemal paavst Benedictus XVI-ndal on õigus – kui Euroopa tahab ellu jääda, vajab ta uut mõistmist iseendast. Euroopa põeb rasket haigust – tema organismis vohab vähkkasvajana mõtteviis, mis lammutab ""tõelise Euroopa"" rakke ja asendab need ""Väär-Euroopaga"", kui laenata Pariisi manifesti autorite väljendust. Just see teeb Euroopat nõrgaks.

Aga Pariisi manifesti tasub tähelepanelikult lugeda ja loetu üle järele mõtelda – veelgi enam, see dokument väärib haritlaskonna ja eriti konservatiivide laia ja põhjalikku arutelu. Manifestis osutatakse Euroopa kristlikele juurtele ja antiiksele pärandile ning toonitatakse, et tõeline Euroopa on eripalgeliste rahvusriikide kogukond. Samuti väljendatakse mõtet, et Euroopa peab taastama vaimse suuruse tunde, s.t terves mõttes uhkuse oma kultuuri tõeliste ja lugupidamisväärsete saavutuste üle.

Erilist tähelepanu tuleb aga pöörata sellele, mida manifestis öeldakse abielu, perekonna ja laste saamise kohta: ""Abielu on kodanikuühiskonna vundament ja mehe ning naise vahelise harmoonia alustala. … Me kinnitame, et meie üks kõige põhjapanevamaid rolle nii ühiskonnas kui inimestena on olla emad ja isad. … Ühiskonnal, mis ei tervita laste olemasolu, pole tulevikku.""

Rehepaplik arvestus, et praeguste põlvkondade keskendumist saavutatud heaolu nautimisele saab pikendada teistest kultuuridest pärit noorusliku tööjõu massilise sissetoomisega, esindab mõtteviisi ""pärast meid tulgu või veeuputus"". Seepärast peab tõelise Euroopa taastamine algama abielust ja perekonnast. Ennekõike eeldab Euroopa idee taastamine aga vaimset hoiakut, mis väärtustab truudust oma identiteedile ja selle aluseks olevatele väärtustele kõrgemalt kui meelelisi naudinguid ja mugavusi.","5 Common Signs You Are Vitamin D Deficient
1. Feeling Depressed
Researchers have found that individuals with low Vitamin D levels are as much as ten times more prone to falling into depression.
2. Feeling Moody
Serotonin is affected by Vitamin D levels. This imbalance can leave you feeling moody and depressed.
3. Achy Bones
Vitamin D deficiency causes a problem absorbing calcium properly. This leaves the skeletal system feeling weak and often times bringing about a throbbing pain radiating from the bone.
4. Constant Fatigue
Feeling tired no matter how much sleep you get? This is a sign of Vitamin D deficiency, often misdiagnosed as Chronic Fatigue Syndrome.
5. High Blood Pressure
Vitamin D plays a huge role in cardiovascular health. It helps to regulate blood pressure, so when you aren’t getting enough Vitamin D, your blood pressure will often rise.
Risk Factors of Vitamin D Deficiency
Age Puts You At Risk
An estimated 95% of US seniors are thought to be Vitamin D deficient. This is because individuals over the age of 70 produce about ⅔ the Vitamin D as compared to a younger individual during the same time spent in the sun.
Weight Puts You At Risk
Vitamin D is fat-soluble, leaving overweight individuals at risk of losing the majority of Vitamin D produced in the skin before it can be properly absorbed and utilized. This leaves overweight individuals at a higher risk of Vitamin D deficiency than someone who is at a healthy weight.
Skin Pigment
Think of skin pigment as the body’s natural UV protection, the darker the pigment, the more difficult it is to achieve optimal Vitamin D levels. Individuals with darker complexions need to spend more time in the sun to achieve the same amount of Vitamin D production as a fairer skinned individual.
Geography and Season
Depending on where you live and what time of year it is, the amount of Vitamin D produced from sun exposure can vary widely. This makes it extremely important for individuals living in the Northern Hemisphere to supplement Vitamin D levels during the winter months.
The Importance of D
With thousands of studies done on Vitamin D, it has proven to be an integral part of our overall health, impacting virtually every bodily system.
Integral to the health and function of the immune system, individuals with autoimmune diseases can benefit greatly by supplementing Vitamin D levels.
Cardiovascular disease is also affected greatly by Vitamin D levels. Individuals with a D deficiency are at a 50% increased risk of suffering from a heart attack. It is also important to help reduce hypertension, risk of suffering a stroke and atherosclerotic heart disease.
Vitamin D plays a role in our DNA health and our cellular metabolic process. This has a profound effect on the health and function of our cells and body as a whole. Improving Vitamin D levels can help to prevent age related health complications and reduce overall body toxicity, potentially adding years to your life!
Test Your D Levels
Getting tested for Vitamin D is easy and available through almost any medical professional. Ask your physician about the 25(OH)D test, also known as 25-Hydroxyvitamin D.
Ideally you want to get tested twice per year to monitor levels. Once in the middle of summer and once again in the middle of winter. This gives you a good baseline for both high and low levels.
Author: Jeffrey Sutton contributes to numerous online health sites and publications. Having spent years specializing in natural health supplements with an emphasis on Glutathione, Jeffrey recently formulated the Glutathione enhancing supplement GSH Gold.
Sources for this article:
ISCD.org
MayoClinicProceedings.org
GRC.com – PDF
MedicineNet.com
",Dissimilar
