EngText Index,EstText Index,Cosine Similarity Score,Similarity Bin,EstText,EngText,Similarity
19927,16889,0.3615951538,4,"Lameda Maa teema on vallutamas maailma – üha enam tuleb välja avaliku elu tegelasi, kes teatavad, et ka nende hinnangul on Maa lame. Möödunud aastal teatas tuntud Briti ekstreemsportlane ja veganaktivist Tim Shieff “London Realile” antud intervjuus, et lame Maa on kõige fundamentaalsem ja olulisem teema, mida inimesed peaksid uurima. Novembris 2016 teatas Aafrika poliitik ja Ubuntu liikumise rajaja Michael Tellinger oma Facebooki kontol, et peale mitmekuist uurimist ei ole tema võimeline tuvastama Maa väidetavat kumerust ega ühtegi teaduslikku tõestust, et Maa oleks pöörlev pall, mis liiguks läbi kosmose: „Kõik, mida ma pidasin enda jaoks pühaks ja vankumatuks tõeks, on raputanud mind hingepõhjani ja kaotanud igasuguse usaldusväärsuse. On selgem kui kunagi varem, et kõik, mis meile on räägitud, on vale ning kõige olulisemad õpetused on jäetud haridussüsteemi kanda, mille eesmärgiks on luua tuleviku tööjõudu ja hoida rahamonstrumit elus ning mitte õpetada meid mõtlema ja anda meile tõelised oskused. Lame Maa on ilmselt suurim vale neist kõigist”.

Nüüd on ka USA-st pärit toitumisguru ja aktivist David “Avocado” Wolfe (46) teatanud, et Maa on lame. Wolfe’i jälgib Facebookis ca 10 miljonit inimest ning lameda Maa teema on mees sisse pookinud ka oma toitumisloengutesse. Alljärgnev on kokkuvõte Wolfe’i vestlustest populaarses Youtube’i saates “Globebusters” ja katkend tema loengust:

Ma alustasin oma karjääri toitumisvaldkonnas, mis on minu lemmik teema. Kui toitumist ja sellega seonduvat piisavalt kaua uurida, siis mõistad, et meile on valetatud ja valetatakse kogu aeg. Meile määritakse pähe toitu, mis ei ole tervislik; toitu, mis sisaldab kemikaale; liha-ja piimatoodetesse lisatakse hormoone. Samasugune pettus nagu käib teadusmaailmas, käib ka toitumismaailmas. Minu isiklik ärkamine saigi alguse toitumisõpetusest. Ideaalis võiksid kõik inimesed oma toitu ise kasvatada või osta mahedalt kasvatatud toitu ja n-ö kodukaupmehi toetada. Sa võiksid näha oma silmaga, kust pärineb toit, mida sa sööd. Sest kui oletame, et Sinu ärkamine sai alguse Maa kuju pettusest, siis ütlen kohe ära, et järgmise asjana soovitan sul uurida toitu, mida sa suust sisse topid.","(Natural News) Facebook has initiated a whole new level of tyranny and censorship to try to eliminate any information about the Wuhan coronavirus that disagrees with the World Health Organization, which is largely run by communist China and is currently led by a former member of a violent communist group.

Late last night, Facebook began banning all links from Brighteon.com, regardless of the content of the videos, claiming that videos about gardening and smoothie recipes and backyard chickens now violate Facebook’s “community guidelines.”

The real reason for the banning, of course, is that Brighteon.com hosts the “Plandemic” video featuring Dr. Judy Mikovits who warns about the dangers of the coronavirus vaccine. Users have posted a Portuguese version of the documentary that has achieved nearly a million views, and a Greek language version is also rapidly gaining hundreds of thousands of views.

The rapid explosion in people viewing the video has resulted in Facebook blacklisting the entire Brighteon platform, confirming Facebook is engaged in anti-trust behavior to try to crush competing platforms by starving them of user traffic. This is blatant criminal anti-trust behavior on the part of Facebook, and it is a direct attack on human knowledge and human freedom.

take our poll - story continues below

Trump or Biden, who will win? Why wait until November 3? Show all of America who you're voting for in 2020

TRUMP or BIDEN You Decide * Donald J. Trump Joe Biden Undecided

Email *

Phone This field is for validation purposes and should be left unchanged. Completing this poll grants you access to DC Dirty Laundry updates free of charge. You may opt out at anytime. You also agree to this site's Privacy Policy and Terms of Use.

Even more importantly, both Facebook and YouTube now openly claim that any content which contradicts the “official” opinions of the W.H.O. will be banned, meaning Facebook and YouTube are now run by communist China, because that’s the anti-human rights regime that dictates the policies of the W.H.O.

Facebook scrubs all Natural News content posted since November of 2019

Adding to the extreme, punitive censorship, Facebook also banned all links from NaturalNews.com and NewsTarget.com while scrubbing all the content we have posted, back to November of 2019, which is the month in which the Wuhan coronavirus bioweapon was released by communist China.

Any attempt to post any link from Natural News or NewsTarget is now blocked by Facebook, and Facebook has scrubbed all our posts about the coronavirus in order to cover up communist China’s war against humanity.

In effect, Facebook is now covering up the bioweapons crimes of communist China by banning independent media publishers that are documenting China’s deliberate engineering and release of this weapon against humanity.

This puts Mark Zuckerberg in the same class as Adolf Hitler and Joseph Stalin, actively carrying out crimes against humanity and defending an anti-human regime that builds weapons of mass destruction to cause mass death on a global scale. Mark Zuckerberg is an enemy of humanity and a criminal against all who value life and liberty.

We repeat our call for the arrest and prosecution of Mark Zuckerberg, Jack Dorsey, Sundar Pichai, Tim Cook and other tech giant CEOs that have engaged in malicious, anti-human censorship that protects communist China and the vaccine industry.

How to share the Plandemic video on Facebook and other platforms without getting banned

Because of the extreme level of criminal censorship being carried out by Facebook, YouTube, Google, Twitter and even Vimeo, the only current way to share Plandemic videos from Brighteon.com or other targeted platforms is to embed the videos on another website page, then share that page.

Each video on Brighteon.com has a “share” link at the bottom right-hand corner:

From the share link, you can copy either the direct link to the video play page or get embed code that embeds the video into any web page. This code can be pasted into the HTML code of any page, including pages that are edited in WordPress or other page editors.

Here’s an example of the embed code for the Plandemic video from the “Jesus Social” channel on Brighteon:

<iframe src=’https://www.brighteon.com/embed/45c1558c-4163-4961-9f92-11c7c4c1af21′ width=’560′ height=’315′ frameborder=’0′ allowfullscreen></iframe>

And here’s the embedded video it produces when you add this code to your web page:

Once the video is embedded in your page, you can then share that page on Facebook or other platforms.

You can also, of course, share Brighteon links on Gab.com and other alternative internet ecosystems that aren’t run by evil globalists working for communist China.

In the future, we will also have alternate URLs and domain names that will allow you to share Brighteon videos, but those domains will of course be eventually banned by Facebook and the other tech giants, all of which are criminal operations that are complicit in communist China’s war against humanity.

The tech giants will not stop until they succeed in destroying humanity and achieving mass death across the globe

We have now arrived at a very dark chapter in human history where the gatekeepers who control online speech are protecting the very communist regime that has declared war on humanity through the deliberate deployment of engineered bioweapons. Mark Zuckerberg and other big tech globalists are criminals against humanity, and they no longer even pretend to support free speech. Instead, they brazenly censor all platforms and publishers that are working to blow the whistle on global criminals who wield weapons of mass destruction against the innocent.

This is why today, we are repeating our call for the arrest and prosecution of Mark Zuckerberg and the CEOs of Google, YouTube, Twitter and Vimeo for their conspiracy against humankind and their deliberate, malicious crimes against human freedom and human survival.

Human freedom cannot coexist with these evil, anti-human regimes. We either dismantle the tech giants and imprison their architects and leaders, or humanity dies in darkness.

Even if it is his last act, President Trump must deploy military police to arrest the CEOs of the tech giants and prosecute them under military tribunals for their crimes against humanity. Trump must order the US State Department to seize the domain names of all the tech giants engaged in malicious censorship, halting their operations until they restore First Amendment protections on their platforms. In just 24 hours, Trump could order the US government to seize Google.com, Apple.com, Twitter.com, YouTube.com, Vimeo.com and all the other domains run by the techno-fascists, and he could force them to either respect the First Amendment or be permanently put out of business.

And no, that isn’t tyranny on the part of government, not when the only demand is that tech platforms must respect the freedoms described in the Bill of Rights. For the free world to thrive, Sec. 230 must be dismantled and free speech must be affirmed across the internet, or humanity has no future other than death and tyranny.

That’s the whole plan behind the coronavirus, of course: To unleash mass death, tyranny and censorship, carrying out a new holocaust against billions of innocent people so that globalists can achieve their depopulation dreams.

Watch my recent interview with Dr. Judy Mikovits to find out why globalists are so afraid of this woman that they are blacklisting entire platforms to prevent her voice from being heard:

No, you won’t be able to share this story on Facebook. That’s by design. You might be able to share it from this alternative URL at Trump.news:

Trump.news/2020-05-20-plandemic-video-super-viral-brighteon-facebook-banning-cleansing-content-wuhan-coronavirus.html

Help us protest Facebook’s punitive, illegal blacklisting of Brighteon and NaturalNews by taking action at this link. Thank you for your support.

Facebook",Dissimilar
20735,8451,0.3132661879,4,"Lisaks sellele ei taheta Eestis arvestada seda, et on kaks Ukrainat, venekeelne ja ukrainakeelne, ning esimene neist ei ole sedavõrd patriootlik, kui see teine – ning esimene on kiirem lahkuja, ukrainak(m)eelsed pigem jäävad.

EKRE poliitik Urmas Reitelmann kommenteerib sotsiaalmeedias Saksamaa näidet: “Saksamaa on vastu võtnud 1 000 000 Ukrainast pärit elukunstnikku. Nende seas korraldati uuring, mille valimis oli 11 000 inimest. Kõigest kolmandik nendest vastas küsitluses, et plaanivad Ukrainasse naasta. See tähendab, et suur osa neist kavatseb Saksamaale jääda pikemalt ning 26% jäädavalt. 17% pagulastest oli küsitluse hetkel töökoht ning nemadki ei kavatsenud kodumaale tagasi pöörduda.

Ukrainlaste kohanemine Saksamaal on olnud valutum, kui mujalt paremat elu otsima tulnud inimeste puhul, kuid miljon immigranti on lisanud survet nii eluasemeturul, kui ka sotsiaal- ja haridusvaldkondades ning see teeb riigisakslatele muret.

Saksa mittetulundusorganisatsioonid korraldavad toiduabi projekte, kus poodidest ja toitlustusettevõtetest kogutakse toidu säilitusaja lõpu eel kokku tarvitamiskõlblikku kraami ning müüakse sümboolse summa eest abivajajaile, ka ukrainlastele.

Abitöötajad peavad ukrainlaste puhul sageli kokku puutuma kaebuste ja agressiivse käitumisega. Ukrainlastele ei meeldi, et nad ei saa ise oma toidukorvi koostada, on rahulolematud, et puuvilljadel on mõnedel juhtudel olnu plekke või salat veidi närtsinud, on olnud ka kliente, kes nõuavad krevette ja kaaviari.

Teiste toiduabi järjekorras seisvate abivajajate seas on pahameelt tekitanud ka luksusmaasturitega abi järele saabunud ukrainlased, kes 2-eurose abipaketi eest tasudes ulatavad 100-eurose pangatähe.”

Rida kommentaare Urmas Reitelmanni postituse alt.

“Enamik ei kavatsegi Ukrainasse naasta, sest nad on tahtnud sealt alati Läände putkata. Ukraina on läbinisti korrumpeerunud riik, kus makse ei maksta, aga varastatakse riigi tagant. Iga liigutuse eest tuleb maksta, ka arstidele haiglas ja politseile liikluses…”

“Põgenik pole sisserändaja, nende tahtel ei peaks mingit tähendust olema. Kui põgenikustaatus on läbi, kuuluvad nad a priori repatrieerimisele. Aktiivne sõjategevus on nüüdseks koondunud Ukraina piirialadele, st. füüsiline ohutegur on enamikus riigis minimaalne. Afganistanist samuti ei evakueeritud kõik 40 miljonit, kuna seal oli madala intensiivsusega sõjategevus ja siin-seal aegajalt kärgatas ja paukus.

On ilmselt siiski oluliselt odavam ELi riikidel aidata põgenikel kohaneda Lääne-Ukrainas kui neid enda juures hoida. Igal juhul pole mõeldav, et suur osa Ukraina elanikkonnast jääkski võõrsile, see oleks nende riigile rahvastikuline katastroof. Tänaseks võiks rääkida juba ettevalmistustest ja koostööst Ukraina valitsusega põgenike kodumaale tagasi saatmiseks. Ka summad, mis on vajalikud Ukrainas elamiseks on murdosa sellest, mida on vaja Lääne-Euroopas.”

“Siia tulnutest samuti suur osa ei kavatse kodumaale naasta… tegelikult pole siia vaja sellist hulka slaavi mentaliteediga inimesi ja juurde ei tohiks neid kindlasti lubada.”

“Samuti nagu Eesti puhul, on ka Saksamaale jõudnud “ukrainlastest” valdav osa Donetski ja Luganski venelased Ukraina passidega – kui küsid, miks te Lääne-Ukrainasse ei lähe, ütlevad, et seal ju bandeeralased! Nii et niipalju siis ukraina põgenikest.”

Kui nüüd keegi väidab, et sellised arvamused on omased vaid rahvuskonservatiivse maailmavaatega inimestele, siis paraku kinnitab neid ka paduliberaal Kersti Kaljulaid.

BNS vahendab: “Rahvusvahelise kaitseuuringute keskuse ajakiri Diplomaatia avaldas lõppenud aasta viimases numbris Kersti Kaljulaidi kommentaari, milles ekspresident kirjutab korruptsiooniprobleemist, mida Ukraina riigivõim senini tunnistamast keeldub.

“Ukraina praegune võim pigem ei tunnista avalikult ega sõpradegi ringis, et neil ikka veel on korruptsiooniprobleem. Ja ilmselgelt loodavad nad, et inimlik kaastunne paneb EL-i silma kinni pigistama, sest nad on ju meie eest surnud,” kirjutab Kaljulaid.

Kaljulaidi sõnul on Ukraina tõeliste sõprade ülesanne aidata mõista, et tegelikult on EL-i liitumisprotsess ühtlasi hea võimalus süsteem puhastada – see aitab Ukrainale tagada nii pikaajalise rahvusvaheliste investeeringute voo kui ka kiire majandusliku konvergentsi.

“See kõik jääb aga ära, kui võit sõjarindel jääb Ukraina rahva ainsaks võiduks,” hoiatab Kaljulaid. “Võit iseenda üle, rohujuurtest üles välja sisseharjunud mustrite üle, ei tule kergelt. Veterinaartõendist riigihankevõiduni – kõige eest ju tuleb ikka maksta. /…/ “Oligarhid, kes kippusid nahka üle kõrvade tõmbama. Kohtusüsteem, kus võitis tähtsam ja tugevam, mitte õiglus. Riigiasutuste otsustajad, kes äripartneriks kippusid,” loetleb Kaljulaid Ukraina probleeme.

On selge, et Ukrainast ei põgeneta ainult sõja eest, vaid kasutatakse seda väljarändeks korruptiivsest riigist. Ainult Eesti võimupoliitikud sulevad silmad ja nutavad “põgenike” kaelas, kes sageli ongi Donbassi venelased.

Uued Uudised","State of the Union addresses often seem interminably long. But with so much ground to cover and so many members of the public tuned in -- not to mention intense media scrutiny -- economic use of words is crucial. And so, after interest groups hear what's in the speech for them, they are often left to parse the meaning and import of just a few sentences.
There is often a balancing act between brevity and full accuracy.
We'll deal with just such a conflict here.
In his State of the Union address on Jan. 25, 2011, President Barack Obama boasted that his administration has made ""great strides over the last two years in using technology and getting rid of waste.""
And he used the U.S. Department of Veterans Affairs as a prime example. ""Veterans can now download their electronic medical records with a click of the mouse,"" Obama said.
Two days later, the Iraq and Afghanistan Veterans of America (IAVA) posted a response on their website accusing Obama of ""mischaracterizing"" the VA electronic medical records system.
""This is not true,"" stated IAVA Founder and Executive Director Paul Rieckhoff. ""Contrary to the president’s comment, the only thing a veteran can download from the VA’s system are pharmaceutical records and personal health information that he or she has self-entered. This is a critical distinction.
""The president’s comments are misleading to service members, veterans and the American public, who now think that this system is in place and functional, while it is clearly not. In the last 24 hours, IAVA has heard from hundreds of members, who have expressed surprise and outrage that the president could get something so wrong in arguably the most important speech of the year.""
In October, the administration formally launched something called the ""VA Blue Button"" which allows veterans to download and view some medical information online. Primarily, it allows veterans to access self-entered health metrics such as blood pressure, weight and heart rate as well as emergency contact information, test results, family health history, military health history and other health-related information. Using data from the patient’s Veterans Health Administration’s Electronic Health Records (VistA), it also allows vets to access information about their VA prescription histories, wellness reminders and VA appointments (both past and future).
Can a vet get all of his or her medical records via the Blue Button? No. You still can't yet get medical records such as doctors' notes or X-rays.
But more and more medical information will become available via the Blue Button over time, said Peter L. Levin, chief technology officer at the Department of Veterans Affairs and the co-creator of the Blue Button. ""The things they can download today are generally the kinds of things you'd fill in on a clipboard when you go to see a specialist,"" Levin said.
In March, the VA plans to add information on allergies, he said. And soon, the Blue Button will offer access to lab results, including chemistry and hematology. ""We are on a steady path, capturing more and more information from VistA and putting it into MyHealthyVet,"" Levin said.
And vets' requests will drive the information that will be added in the future, he said.
""This is actually a monumental VA initiative,"" said Paul Sullivan, executive director of Veterans for Common Sense. ""You have to give the VA some credit."" Perhaps, he said, President Obama should have said medical ""information"" rather than ""medical records"" are now available to vets online, because the phrase implies things like doctors' notes and medical test results are online.
""Maybe he didn't get it exactly right,"" Sullivan said. ""It could come down to word choice. Some of your medical records are online. Some, but not all.""
Joe Davis, a spokesman for Veterans of Foreign Wars, also praised the VA's Blue Button as a ""unique"" feature that puts the VA out front on technology.
But when Obama said, ""Veterans can now download their electronic medical records with a click of the mouse,"" was he accurate?
""Yes, kinda, sorta,"" Davis said. ""They can download a part. 'Some' would have been more accurate. It all depends on your interpretation.""
Davis also said the VFW hasn't gotten any calls from veterans confused by the president's statement. Probably, he said, most realize that in a State of the Union address, every word takes up time, and so the president used a bit of short-hand.
In rating this comment, we weighed the fact that many veterans groups have praised the Blue Button as a major step forward. The medical information now available to veterans is an undeniably valuable technological tool and a praiseworthy advance. But Obama's claim that vets ""can now download their electronic medical records with a click of the mouse"" suggests much more availability than exists. One could reasonably assume he meant a vet could access all of his or her medical records online. In fact, most of the information now available to vets is information they self-entered. Vets can't yet get a lot of medical records though the Blue Button (though more and more information is being added in the near future).",Dissimilar
