EngText Index,EstText Index,Cosine Similarity Score,Similarity Bin,EstText,EngText,Similarity
5843,4134,0.703984201,8,"Üks maailma autoriteetsemaid meditsiiniajakirju BMJ avaldas ülevaate ettevõttes Ventavia Research Group läbi viidud Pfizeri Covid-19 vaktsiini inimkatsetest, mida saatsid uuringuprotseduuride süstemaatiline eiramine ja lohakas andmetöötlus. Uuringust selgub, et kasutusload vaktsiinile saadi kaheldava väärtusega tulemuste pealt.

2020. aasta sügisel üllitas Pfizeri nõukogu esimees ja tegevjuht Albert Bourla avaliku kirja, mis selgitas miljarditele inimestele üle maailma, millal võib oodata pandeemiale lõppu tegevat ""turvalist ja tõhusat"" Covid-19 vaktsiini. ""Nagu ma olen varem rääkinud, me tegutseme teaduse kiirusel,"" kirjutas Bourla.

Samas teadlased, kes tegelesid toona Texase osariigi mitmes laboris Pfizeri vaktsiini testimisega, pidid mainitud ""teaduse kiiruse"" eest maksma kogutud andmete ebausaldusväärsuse ja patsientide turvalisuse eiramisega. Pfizeri tellimusel ravimiuuringuid läbi viiva ettevõtte Ventavia Research Group toonane piirkonnajuht rääkis BMJle, et nende ettevõte manipuleeris uuringute andmetega, korraldas uuringu viisil, et patsientide pimemenetlus (unblinding) osutus võimatuks, palkas vaktsiinisüste tegema ilma vastava hariduse ja kogemusteta inimesi ning viivitas katsetuste üliolulise 3. faasi ajal kõrvalnähtudest teavitamisega.

Ventavia töötajad, kes vastutasid kvaliteedikontrolli eest, mattusid avastatud probleemide kuhja alla. Peale seda, kui uuringu kvaliteedi kontrollijad teavitasid ettevõtet korduvalt, milliste probleemidega nad silmitsi seisavad ja Ventavia midagi selle peale ei teinud, saatis piirkonnajuht Brook Jackson kaebuse Ameerika Ühendriikide Toidu- ja Ravimiametile (US Food and Drug Administration; FDA). Samal päeval Ventavia vallandas Jacksoni. Jackson on inimene, kes andis BMJ-le üle kümneid dokumente, fotosid, helisalvestisi ja e-kirju, mis tõestavad tema süüdistusi.

Ventavial, mis on Ameerika Ühendriikide üks suurimaid eraomanduses olevaid meditsiinitoodete kliiniliste uuringute ettevõtteid, on Jacksoni sõnul tõsiseid probleeme laboratooriumite haldamise, patsientide turvalisuse tagamise ja kogutud andmete tõepärase esitamisega.

Jacksoni, kes on viieteist aastase kogemusega kliiniliste uuringute ekspert ja audiitor, sõnul ei pea Ventavia nõuetekohaselt näiteks kinni pimemenetluse reeglitest. Pfizeri Covid-19 vaktsiini katse ülesehitus oli ettevõttes algusest peale selline, et töötajad, kes valmistasid ette patsientidele manustavaid aineid (Pfizeri vaktsiin ja platseebo), teadsid, mis on mis. Katse tõepärasuse huvides ei oleks nad tohtinud seda teada.

Ühes helisalvestises räägivad kaks Ventavia juhti, kuidas ettevõte ei suuda kvaliteedikontrolli jaoks teha kindlaks kõigi vaktsiiniuuringute dokumentatsioonis esinevate eksituste laadi ega hulka. Ventavia juhtide sõnul oli dokumentatsioonis vigasid ""märkimisväärne hulk"".

Samuti näitavad Jacksoni dokumendid, et Ventavia manipuleeris 2020. aasta augustis ja septembris FDA inspektsiooni kartuses uuringu andmeid.

Teine Ventavia töötaja kirjeldas BMJ-le, kuidas ettevõttes oldi võimaliku Pfizeri vaktsiiniuuringu FDA auditi suhtes väga närvilised. Tavaliselt kujutab FDA uuringu audit ainult dokumentatsiooni üle vaatamist ja kui selles on kõik korras, pole ka põhjust midagi peljata. Ekspertide sõnul on üpris kummaline seegi, et FDA ei saatnud Ventaviasse peale töötaja kaebust audiitoreid.

FDA ravimiuuringute järelvalve on puudulik

2007. aastal avaldas USA tervishoiu ja sotsiaalteenuste ministeeriumi sisekontroll (Department of Health and Human Services' Office of the Inspector General) FDA kliiniliste uuringute kontrollimise tegevuse ülevaate aastatel 2000 kuni 2005. Aruandes leiti, et FDA inspekteeris vaid üht protsenti kliiniliste katsete läbiviimise kohtadest. Viimastel aastatel on FDA vaktsiinide ja bioloogiliste ravimite osakonna (FDA's vaccines and biologics branch) inspektsioonide maht vähenenud ja 2020. eelarveaastal sooritati ainult 50 järelvalvetoimingut.

2020. aasta 25. septembril FDA-le saadetud e-kirjas loetles Jackson üles Ventavia kolmes vaktsiiniuuringute läbi viimise kohas, kus katsetes osales rohkem kui tuhat inimest, esinevad puudused:

patsiendid pidid peale süsti istuma koridoris ja neid ei jälginud nõuetekohaselt meditsiinitöötaja,

kõrvalnähte ei registreeritud, või ei tehtud seda õigeaegselt,

uuringuprotokollide eiramistest ei antud teada,

vaktsiine ei säilitatud nõutud temperatuuridel,

laboratoorseid proove märgistati ekslikult,

töötajaid, kes viidatud probleemidest juhtkonda teavitasid, sunniti vaikima.

Kui Pfizer esitas 10. detsembril 2020 toimunud FDA nõukogu istungile, millel arutati Pfizeri vaktsiini kasutusele võtmiseks eriloa väljastamist, oma vaktsiini uuringute ülevaate, vaikis ravimiettevõte Ventavia katsetega seotud probleemid maha.

Pfizeri Covid-19 vaktsiin kiideti lõplikult heaks käesoleva aasta augustis, millega koos andis FDA ka ülevaate seoses selle kliiniliste uuringutega toime pandud inspektsioonidest. Saja viiekümne kolmest uuringuid läbi viinud ülikoolide, haiglate ja eraettevõtete üksusest vaadati üle ainult üheksa ja neist ükski ei kuulunud Ventaviale.

Jacksoni väiteid kinnitavad ka mitmed teised Ventavia endised töötajad. Üks endine töötaja kirjeldas, et ta on aidanud oma karjääri jooksul läbi viia ligi poolsada suuremahulist ravimiuuringut, kuid mitte kunagi pole ta näinud nii rabistavat ja hoolimatut (helter skelter) töökeskkonda kui Pfizeri Covid-19 vaktsiiniuuringute ajal Ventavias. Tema sõnul oli kogu Ventavias läbi viidud kõnealune uuring üks ""hullumeelne segadus"".

Peale seda, kui Jackson andis FDA-le 2020. aasta septembris Ventavia probleemidest aru, on Pfizer palganud ettevõtte veel nelja vaktsiini – Covid-19 vaktsiin lastele ja noortele, Covid-19 vaktsiin rasedatele, võimendav vaktsiinidoos ja RSV vaktsiin – kliiniliste uuringute läbiviijaks.

2. novembril kiitis FDA Pfizeri laste ja noorte Covid-19 vaktsiini heaks ja seda on Ameerika Ühendriikides lubatud kasutada alates viie aastaste laste peal.

Toimetas Karol Kallas","Another year has passed and although anti-vaccine folks keep talking about those 300 vaccines in pipeline, there were few new developments in the vaccine world in 2018.
This happened in 2018.
Well, maybe that’s not entirely true.
Vaccines – Year in Review 2018
So what can we say about 2018 when it comes to vaccines?
Well, we did get some new ones!
approved by the FDA in late 2017, a new hepatitis B vaccine for adults, Heplisav-B, the formal recommendation for its use from the ACIP came on February 21, 2018although it was both approved by the FDA and formally recommended by the ACIP in late 2017, Shingrix, the new shingles vaccine, became more widely available in 2018 – well kind of – there have been a lot of shortages due to high demand for the vaccineVaxelis, a hexavalent vaccine that combines DTaP-IPV-Hib-HepB into one shot was FDA approved on December 21, 2018, but likely won’t be available for a few more yearsFluMist, the nasal spray flu vaccine, returned
And we lost one… Last year was the first full year that Menomune, an older meningococcal vaccine, was no longer available. It was discontinued because of low demand, as we began to use the newer vaccines, Menactra and Menveo instead.
In other immunization news:
a 2017 shortage of yellow fever vaccine continued into 2018a shortage of monovalent pediatric hepatitis B vaccine will continue into 2019 (doesn’t affect combination vaccines with hepatitis B)Gardasil 9 received an expanded recommendation – women and men between the ages of 27 and 45 years can now get vaccinated and protected with this HPV vaccinethe hepatitis A vaccine got a lower age recommendation – at least in special situations – “HepA vaccine be administered to infants aged 6–11 months traveling outside the United States when protection against HAV is recommended.”the recommendation to use a third dose of MMR to control outbreaks of mumps was formally approvedthe WHO updated its recommendations for use of the dengue fever vaccine (Dengvaxia) to makes sure that only dengue-seropositive persons are vaccinated, as they found an increased risk of severe dengue in seronegative people who were vaccinatedOf the 163 million to 168 million doses of flu vaccine that will be distributed in the United States for the 2018-2019 season, more than 80% will be thimerosal free.China had an issue with substandard DTaP vaccines made by one company in one part of the countryIndia had an issue with contaminated polio vaccines made by one company in one part of the country – bivalent oral polio vaccines (two strains) still contained all three strains of polio vaccine virusMeasles cases and deaths spiked globally because of gaps in vaccination coverage
If you didn’t hear about any of those things in the news, you may have heard about the death of two young children in Samoa after they received an MMR vaccine. That tragedy almost certainly was caused by an error in administering/mixing the vaccines, and not because there was anything wrong with the vaccines themselves. 
Need help getting educated about vaccines? Despite continued outbreaks, 2018 was a good year for vaccine advocates and vaccine education. 
Several good books about vaccines were published, including:
Between Hope and Fear: A History of Vaccines and Human ImmunityBad Advice: Or Why Celebrities, Politicians, and Activists Aren’t Your Best Source of Health InformationVaccines Did Not Cause Rachel’s Autism
And in case you missed it, we found out that:
Repeat vaccination is safe for most kids with mild to moderate reactions Bots and Russian trolls influenced vaccine discussion on Twitter, research findsMeasles vaccine increases child survival beyond protecting against measlesImmunization in the early third trimester provided newborns with protection against pertussisTdap Vaccination for Pregnant Women Does Not Increase Risk of AutismA large US VAERS study finds DTaP vaccine safeGetting vaccinated prevents flu hospitalization in pregnant womenThe use of the Prevnar and Hib vaccines have dramatically cut pediatric mortalityThere was no increased risk of intussusception after use of the Rotarix rotavirus vaccineThe human papillomavirus (HPV) vaccine does protect young women from developing cervical cancerFlu vaccines are not associated with an increased risk of epilepsyStudy finds no immune overload for US kids’ vaccine scheduleMany parents who initially decline HPV vaccination for their kids, later accept it when they learn more about the vaccineChildren with autism and their younger siblings tend to be undervaccinatedThe incidence of shingles is declining in kids getting vaccinated with the chicken pox vaccine
Of course, for most of us, none of this is really news. We know that vaccines are safe, effective, and necessary.
And sadly, Betty Bumpers died. We can honor her legacy by continuing her work and helping to make sure that every child gets vaccinated and protected.
More on Vaccines Year in Review 2018
In Memory of Betty BumpersBetty Bumpers, Campaigner for Childhood Vaccinations, Dies at 93The official 2018 top ten list from the Skeptical RaptorGates Foundation – Year in Review 2018Official Vaccine Releases: View All by Date 2018FDA – Biological Approvals by Year > 2018 Immunization News and InformationWHO – Immunization NewsCIDRAP Vaccine News ECDC – Immunization NewsRecommendations of the Advisory Committee on Immunization Practices for Use of Herpes Zoster VaccinesFDA – VaxelisFDA – HEPLISAV-BMMWR – Recommendations of the Advisory Committee on Immunization Practices for Use of a Hepatitis B Vaccine with a Novel AdjuvantFDA – Gardasil 9MMWR – Update: Recommendations of the Advisory Committee on Immunization Practices for Use of Hepatitis A Vaccine for Postexposure Prophylaxis and for Preexposure Prophylaxis for International TravelMMWR – Recommendation of the Advisory Committee on Immunization Practices for Use of a Third Dose of Mumps Virus–Containing Vaccine in Persons at Increased Risk for Mumps During an OutbreakACIP RecommendationsWHO – Revised SAGE recommendation on use of dengue vaccineCDC – Current Vaccine Shortages & DelaysStudy – Very Low Prevalence of Vaccine Human Papillomavirus Types Among 18- to 35-Year Old Australian Women 9 Years Following Implementation of VaccinationCDC – Seasonal Influenza Vaccine Supply for the U.S. 2018-2019 Influenza SeasonAntivaccine pediatrician Dr. Bob Sears finally faces discipline from the Medical Board of CaliforniaLessons From California’s Discipline of a Popular Physician for Vaccination Exemptions Without Medical Cause
Share this:TweetPrintEmailShare on TumblrWhatsApp",Dissimilar
17020,4680,0.7184798717,8,"Konservatiivse portaali Project Veritas eestvedaja James O’Keefe avaldas selle nädala teisipäeval videosalvestuse, kus mitmed Pfizeri poolt palgatud teadlased kinnitavad väidet, et COVID-19 läbipõdemisest saadav immuunsus on tugevam, kui erinevatest vaktsiinidest saadav kaitse. Pfizeri biokeemik Nick Karl, kes osales COVID vaktsiini väljatöötamisel, ütles et koroona läbipõdenud inimesel on viiruse vastu rohkem antikehasid, samas kui vaktsiini puhul on organismi immuunvastuse teke piiratud ainult ogavalgule.

„See tähendab, et see vaktsiin, nagu ma ütlesin see valk, on ainult väljaspool. On ainult ühed antikehad viiruse ühe spetsiifilise osa vastu. Kui inimene päriselt viiruga nakatub, hakkab organism tootma antikehasid viiruse erinevate osade vastu, mitte ainult selle välise osa, vaid sisemise osa vastu, mis on päriselt viirus,“ selgitab Karl.

Lisaks mõistab Karl hukka valitsuste surve sundida inimesi vaktsineerima. „Mul on tunne, et seda tehakse, sest linn näiteks tahab, et oleksid vaktsiinipassid ja muu – et muuta kõik vaktsineerimata inimestele hästi ebamugavaks, kuni nad on lihtsalt nii häiritud, et ütlevad, pagan, ma teen selle vaktsiini ära.“

Pfizeri vanemteadur Chris Croce toetas Karli väidet, kinnitades samuti, et loomuliku immuunsusega inimene on ilmselt paremini kaitstud, kui naiivselt vaktsiini kaitsesse uskuv inimene.

Croce kritiseeris ühtlasi Pfizerit selle eest, et ravimifirma väidetavalt eiras teisi COVIDi ravivõimalusi ja keskendus ainult vaktsiinide propageerimisele, ehkki videos ei olnud tema kommentaari täpne sisu päris selge. „Mul on endiselt tunne, nagu ma töötaksin pahatahtliku korporatsiooni heaks, sest lõpuks on oluline vaid kasum. Mina olen siin, et aidata inimesi, mitte teenida miljoneid ja miljoneid dollareid. Leian, et tegemist on moraalse dilemmaga.“

Ta mainis, et on terve hulk ettevõtteid, kellele põhimõtteliselt anti hunnikutes raha vaktsiinide tootmiseks ja nüüd surutakse vaktsiine peale. Samuti rikutakse tema sõnul seadust sellega, et jälgitakse inimeste vaktsineerimisstaatust. „Kellelgi ei ole õigust küsida sinult, kas sa oled vaktsineeritud või mitte.“

Croce puudutas ka vaktsiinide kõrvaltoimete teemat, näiteks arvukaid müokardiidi juhtumeid, mainides, et Pfizer on hakanud uurima võimalikke seoseid vaktsiinide ja infarktide vahel. Tema sõnul on südamepõletiku teke tõsine mure, eriti just nooremate inimeste puhul.

Ka kolmas Pfizeri teadlane, Rahul Khandke, väitis videos, et loomulik immuunsus on suure tõenäosusega vaktsiinidest parem. „Meid on nagu aretatud nii ja meile on õpetatud, et vaktsiin on turvalisem kui COVIDi läbipõdemine. Ja ausalt öeldes – meil on olnud sel teemal väga palju seminare, te ei kujuta ette. Me peame seal istuma tundide kaupa ja kuulama jutte nagu: te ei tohi seda avalikkusele rääkida…“

Allikas: Israel National News","""An image shared on Facebook purportedly shows a tweet from Republican Kentucky Sen. Rand Paul in which he claims to have evidence that COVID-19 vaccines are “harming and killing people.”""",Dissimilar
